Title,Price,Location,Surface,Number_of_Rooms,Floor,Finishing_Condition,Heating,Parking_Space,Balcony_Garden_Terrace,Link,Voivodeship,City
"3p 49m2 Do remontu, dwustronne z balkonem Żoliborz",735000.0,"Sady Żoliborskie, Żoliborz, Warszawa, mazowieckie",49.0,3 ,3/10,do remontu,,,,https://www.otodom.pl/pl/oferta/3p-49m2-do-remontu-dwustronne-z-balkonem-zoliborz-ID4nW6S,Mazowieckie,Warszawa
4-pokojowe mieszkanie 63m2 + balkon Bezpośrednio,,"ul. Dionizosa, Nowodwory, Białołęka, Warszawa, mazowieckie",63.0,4 ,6/8,do wykończenia,,garaż/miejsce parkingowe,balkon,https://www.otodom.pl/pl/oferta/4-pokojowe-mieszkanie-63m2-balkon-bezposrednio-ID4nuD1,Mazowieckie,Warszawa
Żoliborz! 3 pokoje blisko pl. Wilsona,1650600.0,"ul. Zygmunta Krasińskiego, Stary Żoliborz, Żoliborz, Warszawa, mazowieckie",78.6,3 ,3/5,,,garaż/miejsce parkingowe,balkon,https://www.otodom.pl/pl/oferta/zoliborz-3-pokoje-blisko-pl-wilsona-ID4nW6G,Mazowieckie,Warszawa
Mokotów. Dwa pokoje. Duża loggia.,615000.0,"ul. Sardyńska, Stegny, Mokotów, Warszawa, mazowieckie",42.3,2 ,6/10,,miejskie,,balkon,https://www.otodom.pl/pl/oferta/mokotow-dwa-pokoje-duza-loggia-ID4nW6u,Mazowieckie,Warszawa
Górna Droga 2 pokoje 2001 r,650000.0,"ul. Górna Droga, Czechowice, Ursus, Warszawa, mazowieckie",59.1,2 ,1/7,do zamieszkania,kotłownia,garaż/miejsce parkingowe,balkon,https://www.otodom.pl/pl/oferta/gorna-droga-2-pokoje-2001-r-ID4nqLs,Mazowieckie,Warszawa
Dwupoziomowe mieszkanie na Mokotowie,1340000.0,"ul. Bartycka, Siekierki, Mokotów, Warszawa, mazowieckie",130.0,4 ,3/3,do zamieszkania,miejskie,garaż/miejsce parkingowe,,https://www.otodom.pl/pl/oferta/dwupoziomowe-mieszkanie-na-mokotowie-ID4mMlX,Mazowieckie,Warszawa
Mieszkanie 2 pok w kamienicy na Starej Ochocie,720000.0,"ul. Białobrzeska 55, Stara Ochota, Ochota, Warszawa, mazowieckie",44.2,2 ,1/3,do wykończenia,miejskie,,balkon,https://www.otodom.pl/pl/oferta/mieszkanie-2-pok-w-kamienicy-na-starej-ochocie-ID4mGtX,Mazowieckie,Warszawa
"Dwupokojowe z balkonem do zamieszkania, Metro",620000.0,"ul. Jesiennych Liści, Grodzisk, Białołęka, Warszawa, mazowieckie",38.7,2 ,1/2,do zamieszkania,miejskie,garaż/miejsce parkingowe,balkon,https://www.otodom.pl/pl/oferta/dwupokojowe-z-balkonem-do-zamieszkania-metro-ID4nW3T,Mazowieckie,Warszawa
"Mieszkanie, 36,81 m², Warszawa",559000.0,"Saska Kępa, Praga-Południe, Warszawa, mazowieckie",36.81,1 ,2/3,do zamieszkania,miejskie,,balkon,https://www.otodom.pl/pl/oferta/mieszkanie-36-81-m-warszawa-ID4nW3J,Mazowieckie,Warszawa
Komfortowa Garsoniera w Ścisłym Centum Warszawy,710000.0,"ul. Krucza 51, Śródmieście Północne, Śródmieście, Warszawa, mazowieckie",24.0,1 ,7/7,do zamieszkania,miejskie,,,https://www.otodom.pl/pl/oferta/komfortowa-garsoniera-w-scislym-centum-warszawy-ID4nJ1x,Mazowieckie,Warszawa
Nowe 3 pokoje 76m2 Rytm Kabaty Garaż,1359000.0,"ul. Jerzego Iwanowa-Szajnowicza, Kabaty, Ursynów, Warszawa, mazowieckie",76.19,3 ,1,,,,,https://www.otodom.pl/pl/oferta/nowe-3-pokoje-76m2-rytm-kabaty-garaz-ID4mwXM,Mazowieckie,Warszawa
Powiśle - dwa pokoje w dobrej cenie,720000.0,"Solec, Śródmieście, Warszawa, mazowieckie",36.0,2 ,2/8,do remontu,miejskie,garaż/miejsce parkingowe,balkon,https://www.otodom.pl/pl/oferta/powisle-dwa-pokoje-w-dobrej-cenie-ID4nOuh,Mazowieckie,Warszawa
2 pokoje z loggią i garażem w apartamentowcu 2016,729500.0,"Elsnerów, Targówek, Warszawa, mazowieckie",50.0,2 ,3/3,do zamieszkania,miejskie,,,https://www.otodom.pl/pl/oferta/2-pokoje-z-loggia-i-garazem-w-apartamentowcu-2016-ID4nW28,Mazowieckie,Warszawa
"3pok.Balkon,Stary Zielony Mokotów",990000.0,"Stary Mokotów, Mokotów, Warszawa, mazowieckie",63.0,3 ,4/5,do remontu,miejskie,,balkon,https://www.otodom.pl/pl/oferta/3pok-balkon-stary-zielony-mokotow-ID4nW29,Mazowieckie,Warszawa
"Apartament na Ochocie dla rodziny, dla inwestorów",1480000.0,"Szczęśliwice, Ochota, Warszawa, mazowieckie",95.7,4 ,2/9,do zamieszkania,miejskie,garaż/miejsce parkingowe,"balkon, ogródek, taras",https://www.otodom.pl/pl/oferta/apartament-na-ochocie-dla-rodziny-dla-inwestorow-ID4nJxm,Mazowieckie,Warszawa
"2 Pokoje, W Cenie Garaż I Komórka, Metro Kabaty",799000.0,"Kabaty, Ursynów, Warszawa, mazowieckie",47.0,2 ,1/3,,,garaż/miejsce parkingowe,balkon,https://www.otodom.pl/pl/oferta/2-pokoje-w-cenie-garaz-i-komorka-metro-kabaty-ID4nW2X,Mazowieckie,Warszawa
LOFT GARDEN Wesoła ETAP II 53-99m2 - apart. LOFT,1082314.0,"Zielona-Grzybowa, Wesoła, Warszawa, mazowieckie",99.78,4 ,1/1,,inne,garaż/miejsce parkingowe,"balkon, taras",https://www.otodom.pl/pl/oferta/loft-garden-wesola-etap-ii-53-99m2-apart-loft-ID4m4MQ,Mazowieckie,Warszawa
"Apartamenty Patria - Powiśle, widok na zieleń!",1890000.0,"ul. Leona Kruczkowskiego, Solec, Śródmieście, Warszawa, mazowieckie",67.5,3 ,4/8,,,garaż/miejsce parkingowe,balkon,https://www.otodom.pl/pl/oferta/apartamenty-patria-powisle-widok-na-zielen-ID4nAn6,Mazowieckie,Warszawa
Sprzedam mieszkanie 32 mkw - MOKOTÓW STEGNY,595000.0,"ul. Kaspijska, Stegny, Mokotów, Warszawa, mazowieckie",32.0,2 ,parter/9,do zamieszkania,miejskie,,,https://www.otodom.pl/pl/oferta/sprzedam-mieszkanie-32-mkw-mokotow-stegny-ID4nO01,Mazowieckie,Warszawa
Bielany-Żoliborz. Skanska. Dwa pokoje.Balkon.,895000.0,"ul. Rudzka, Marymont-Kaskada, Bielany, Warszawa, mazowieckie",43.4,2 ,parter/6,do zamieszkania,miejskie,garaż/miejsce parkingowe,balkon,https://www.otodom.pl/pl/oferta/bielany-zoliborz-skanska-dwa-pokoje-balkon-ID4nPdF,Mazowieckie,Warszawa
2-pokojowe mieszkanie 36m2 + balkon Bez Prowizji,,"ul.Ostródzka, Brzeziny, Białołęka, Warszawa, mazowieckie",36.71,2 ,1/3,do wykończenia,,garaż/miejsce parkingowe,balkon,https://www.otodom.pl/pl/oferta/2-pokojowe-mieszkanie-36m2-balkon-bez-prowizji-ID4nW2s,Mazowieckie,Warszawa
Penthouse na Alei Szucha - Kamienica z 1910 roku,3326900.0,"al. Aleja Jana Chrystiana Szucha, Śródmieście Południowe, Śródmieście, Warszawa, mazowieckie",175.1,5 ,6/6,do remontu,miejskie,,balkon,https://www.otodom.pl/pl/oferta/penthouse-na-alei-szucha-kamienica-z-1910-roku-ID4kzm5,Mazowieckie,Warszawa
Penthouse na Alei Szucha - Kamienica z 1910 roku,2623520.0,"al. Aleja Jana Chrystiana Szucha, Śródmieście Południowe, Śródmieście, Warszawa, mazowieckie",138.08,4 ,6/6,do remontu,miejskie,,balkon,https://www.otodom.pl/pl/oferta/penthouse-na-alei-szucha-kamienica-z-1910-roku-ID4kzm4,Mazowieckie,Warszawa
2-pokojowe mieszkanie 44m2 + balkon,863086.0,"ul. Redutowa, Ulrychów, Wola, Warszawa, mazowieckie",44.08,2 ,5/8,do wykończenia,,garaż/miejsce parkingowe,balkon,https://www.otodom.pl/pl/oferta/2-pokojowe-mieszkanie-44m2-balkon-ID4jwYc,Mazowieckie,Warszawa
4-pok mieszkanie 144m +ogród 260m +2 garaże,1140000.0,"ul. Głębocka, Białołęka Dworska, Białołęka, Warszawa, mazowieckie",144.3,4 ,parter/1,do wykończenia,inne,garaż/miejsce parkingowe,"ogródek, taras",https://www.otodom.pl/pl/oferta/4-pok-mieszkanie-144m-ogrod-260m-2-garaze-ID4mezt,Mazowieckie,Warszawa
3-pok mieszkanie 112m +taras 37m +garaż Kredyt 2%,799000.0,"ul. Głębocka, Grodzisk, Białołęka, Warszawa, mazowieckie",112.31,3 ,1/1,do wykończenia,inne,garaż/miejsce parkingowe,taras,https://www.otodom.pl/pl/oferta/3-pok-mieszkanie-112m-taras-37m-garaz-kredyt-2-ID4mezD,Mazowieckie,Warszawa
"Mieszkanie 2 pokojowe , Centrum, metro Rondo Onz",769000.0,"ul. Śliska, Śródmieście Północne, Śródmieście, Warszawa, mazowieckie",36.0,2 ,10/12,,,,,https://www.otodom.pl/pl/oferta/mieszkanie-2-pokojowe-centrum-metro-rondo-onz-ID4nW1Q,Mazowieckie,Warszawa
2-POKOJOWE MIESZKANIE - pod klucz | odbiór 2023 r.,63518046.0,"ul. Płochocińska, Szamocin, Białołęka, Warszawa, mazowieckie",48.54,2 ,parter/2,do zamieszkania,miejskie,garaż/miejsce parkingowe,balkon,https://www.otodom.pl/pl/oferta/2-pokojowe-mieszkanie-pod-klucz-odbior-2023-r-ID4nhrW,Mazowieckie,Warszawa
Cesja gotowe do odbioru Royal Residence garaż,760000.0,"ul. Sarmacka, Błonia Wilanowskie, Wilanów, Warszawa, mazowieckie",35.76,2 ,1/4,do wykończenia,miejskie,garaż/miejsce parkingowe,balkon,https://www.otodom.pl/pl/oferta/cesja-gotowe-do-odbioru-royal-residence-garaz-ID4nW1B,Mazowieckie,Warszawa
"2 Pokoje, Balkon, Komórka W Cenie, Metro Natolin.",799000.0,"Natolin, Ursynów, Warszawa, mazowieckie",45.52,2 ,6/9,do zamieszkania,miejskie,,balkon,https://www.otodom.pl/pl/oferta/2-pokoje-balkon-komorka-w-cenie-metro-natolin-ID4nW1t,Mazowieckie,Warszawa
3 POKOJE z odbiorem w grudniu - program 2%,708186.0,"ul. Skrajna, Elsnerów, Targówek, Warszawa, mazowieckie",66.81,3 ,4/6,do wykończenia,miejskie,garaż/miejsce parkingowe,balkon,https://www.otodom.pl/pl/oferta/3-pokoje-z-odbiorem-w-grudniu-program-2-ID4nNMR,Mazowieckie,Warszawa
Soft loft – wyjątkowe mieszkanie na Zawadach,1790000.0,"ul. Bruzdowa, Zawady, Wilanów, Warszawa, mazowieckie",121.0,4 ,1/2,do zamieszkania,kotłownia,garaż/miejsce parkingowe,taras,https://www.otodom.pl/pl/oferta/soft-loft-wyjatkowe-mieszkanie-na-zawadach-ID49Y11,Mazowieckie,Warszawa
"Sprzedam Mieszkanie Rydygiera 3pok, Garaż, 62m2",1300000.0,"ul. Ludwika Rydygiera, Sady Żoliborskie, Żoliborz, Warszawa, mazowieckie",62.0,3 ,2,do zamieszkania,,garaż/miejsce parkingowe,balkon,https://www.otodom.pl/pl/oferta/sprzedam-mieszkanie-rydygiera-3pok-garaz-62m2-ID4nOc3,Mazowieckie,Warszawa
Saska Kępa- Dojazd Do Centrum 10 Minut,779000.0,"al. Aleja Stanów Zjednoczonych, Saska Kępa, Praga-Południe, Warszawa, mazowieckie",56.28,3 ,9/10,do remontu,miejskie,,balkon,https://www.otodom.pl/pl/oferta/saska-kepa-dojazd-do-centrum-10-minut-ID4nW1c,Mazowieckie,Warszawa
"Okazja Cenowa, widna kuchnia,Niski blok, 2 balkony",649000.0,"Huta, Bielany, Warszawa, mazowieckie",48.0,3 ,,do remontu,inne,,,https://www.otodom.pl/pl/oferta/okazja-cenowa-widna-kuchnia-niski-blok-2-balkony-ID4nW18,Mazowieckie,Warszawa
2-pokojowe mieszkanie 47m2 + balkon Bez Prowizji,730100.0,"ul. Optyków, Gocław, Praga-Południe, Warszawa, mazowieckie",47.76,2 ,parter/5,do wykończenia,,garaż/miejsce parkingowe,balkon,https://www.otodom.pl/pl/oferta/2-pokojowe-mieszkanie-47m2-balkon-bez-prowizji-ID4i0cU,Mazowieckie,Warszawa
Piękne mieszkanie premium na Gocławiu,680000.0,"Gocław, Praga-Południe, Warszawa, mazowieckie",36.6,2 ,1/10,do zamieszkania,miejskie,,,https://www.otodom.pl/pl/oferta/piekne-mieszkanie-premium-na-goclawiu-ID4nW0R,Mazowieckie,Warszawa
"Atrakcyjne mieszkanie 3p. 75,2 m2 Ursus Skorosze",989000.0,"ul. Ryżowa, Skorosze, Ursus, Warszawa, mazowieckie",75.2,3 ,2/6,do zamieszkania,gazowe,,balkon,https://www.otodom.pl/pl/oferta/atrakcyjne-mieszkanie-3p-75-2-m2-ursus-skorosze-ID4nn1l,Mazowieckie,Warszawa
Kredyt 2% l Metro 550m | BEZPOŚREDNIO,649000.0,"ul. Redutowa, Ulrychów, Wola, Warszawa, mazowieckie",37.0,2 ,6/10,do zamieszkania,miejskie,,,https://www.otodom.pl/pl/oferta/kredyt-2-l-metro-550m-bezposrednio-ID4nA6g,Mazowieckie,Warszawa
*Fenomenalne mieszkanie dla rodziny* Metro Imielin,1389000.0,"ul. Alternatywy, Stary Imielin, Ursynów, Warszawa, mazowieckie",72.71,3 ,1/5,do zamieszkania,miejskie,garaż/miejsce parkingowe,ogródek,https://www.otodom.pl/pl/oferta/fenomenalne-mieszkanie-dla-rodziny-metro-imielin-ID4nW0a,Mazowieckie,Warszawa
2-pokojowe mieszkanie 38m2 + balkon Bezpośrednio,490496.0,"ul. Chełmżyńska, Kawęczyn-Wygoda, Rembertów, Warszawa, mazowieckie",38.32,2 ,1/5,do wykończenia,,garaż/miejsce parkingowe,balkon,https://www.otodom.pl/pl/oferta/2-pokojowe-mieszkanie-38m2-balkon-bezposrednio-ID4ltMe,Mazowieckie,Warszawa
Nowe budownictwo/ garaż/ duży balkon!,760000.0,"Gocławek, Praga-Południe, Warszawa, mazowieckie",56.0,2 ,1/5,do zamieszkania,miejskie,,"balkon, taras",https://www.otodom.pl/pl/oferta/nowe-budownictwo-garaz-duzy-balkon-ID4nKTw,Mazowieckie,Warszawa
Dwie łazienki | Duży balkon | 3 min od tramwaj,1299708.0,"ul. Dywizjonu 303 303, Górce, Bemowo, Warszawa, mazowieckie",72.21,4 ,3/5,do zamieszkania,miejskie,garaż/miejsce parkingowe,"balkon, taras",https://www.otodom.pl/pl/oferta/dwie-lazienki-duzy-balkon-3-min-od-tramwaj-ID4nLXa,Mazowieckie,Warszawa
Widok w cenie ! Wyjątkowa lokalizacja!,680000.0,"ul. Pańska, Mirów, Wola, Warszawa, mazowieckie",39.0,2 ,> 10/12,do remontu,miejskie,,balkon,https://www.otodom.pl/pl/oferta/widok-w-cenie-wyjatkowa-lokalizacja-ID4nQ9N,Mazowieckie,Warszawa
OKAZJA wyjątkowe mieszkanie | Saska Kępa,500000.0,"Saska Kępa, Praga-Południe, Warszawa, mazowieckie",38.0,2 ,,,,,,https://www.otodom.pl/pl/oferta/okazja-wyjatkowe-mieszkanie-saska-kepa-ID4nNPk,Mazowieckie,Warszawa
"Gotowe mieszkanie na ""leśnym"" osiedlu",805545.0,"ul. Aluzyjna, Nowodwory, Białołęka, Warszawa, mazowieckie",59.67,3 ,3/3,do wykończenia,inne,garaż/miejsce parkingowe,balkon,https://www.otodom.pl/pl/oferta/gotowe-mieszkanie-na-lesnym-osiedlu-ID4nW00,Mazowieckie,Warszawa
Mieszkanie dla rodziny przy metrze Wawrzyszew,1684500.0,"al. Aleja Władysława Reymonta, Stare Bielany, Bielany, Warszawa, mazowieckie",80.21,4 ,1/4,do wykończenia,miejskie,,,https://www.otodom.pl/pl/oferta/mieszkanie-dla-rodziny-przy-metrze-wawrzyszew-ID4nUZZ,Mazowieckie,Warszawa
Idealna pod wynajem kawalerka przy metrze M1,686000.0,"al. Aleja Władysława Reymonta, Stare Bielany, Bielany, Warszawa, mazowieckie",30.49,1 ,2/4,do wykończenia,miejskie,garaż/miejsce parkingowe,balkon,https://www.otodom.pl/pl/oferta/idealna-pod-wynajem-kawalerka-przy-metrze-m1-ID4nUZX,Mazowieckie,Warszawa
Kawalerka blisko Parku Hassów,415000.0,"Niedźwiadek, Ursus, Warszawa, mazowieckie",31.0,1 ,2/4,do zamieszkania,miejskie,,balkon,https://www.otodom.pl/pl/oferta/kawalerka-blisko-parku-hassow-ID4nUV1,Mazowieckie,Warszawa
4-pokojowe mieszkanie 72m2 + ogródek,,"ul. Duninów, Henryków, Białołęka, Warszawa, mazowieckie",72.68,4 ,parter/4,do wykończenia,,garaż/miejsce parkingowe,"taras, ogródek",https://www.otodom.pl/pl/oferta/4-pokojowe-mieszkanie-72m2-ogrodek-ID4c9kF,Mazowieckie,Warszawa
"3 lub 4 pokoje Ursynów, Kabaty. Garaż",1250000.0,"ul. Romualda Mielczarskiego 1, Kabaty, Ursynów, Warszawa, mazowieckie",100.1,4 ,3/4,,miejskie,garaż/miejsce parkingowe,balkon,https://www.otodom.pl/pl/oferta/3-lub-4-pokoje-ursynow-kabaty-garaz-ID4nPpn,Mazowieckie,Warszawa
Nowe | Wola | 2 Pokoje | Apartament 2020r | Kw,718500.0,"ul. Stańczyka, Odolany, Wola, Warszawa, mazowieckie",38.0,2 ,6/8,do zamieszkania,miejskie,,balkon,https://www.otodom.pl/pl/oferta/nowe-wola-2-pokoje-apartament-2020r-kw-ID4nxMe,Mazowieckie,Warszawa
Luksusowy apartament w sercu prestiżowej dzielnice,1180000.0,"al. Aleja Rzeczypospolitej 33, Błonia Wilanowskie, Wilanów, Warszawa, mazowieckie",52.3,3 ,parter/4,do zamieszkania,miejskie,garaż/miejsce parkingowe,"ogródek, taras",https://www.otodom.pl/pl/oferta/luksusowy-apartament-w-sercu-prestizowej-dzielnice-ID4myU1,Mazowieckie,Warszawa
Komfortowy apartament na Ursynowie z ogródkiem,1751900.0,"ul. Wilczy Dół, Kabaty, Ursynów, Warszawa, mazowieckie",89.62,4 ,parter/4,do wykończenia,miejskie,garaż/miejsce parkingowe,ogródek,https://www.otodom.pl/pl/oferta/komfortowy-apartament-na-ursynowie-z-ogrodkiem-ID4nUUh,Mazowieckie,Warszawa
Komfortowy apartament na Mokotowię,3547119.0,"ul. Władysława Orkana, Ksawerów, Mokotów, Warszawa, mazowieckie",130.89,4 ,parter/3,do wykończenia,inne,garaż/miejsce parkingowe,"ogródek, taras",https://www.otodom.pl/pl/oferta/komfortowy-apartament-na-mokotowie-ID4nUUg,Mazowieckie,Warszawa
"Komfortowe, trzypokojowe mieszkanie na Tarchominie",782000.0,"ul. Myśliborska, Tarchomin, Białołęka, Warszawa, mazowieckie",62.07,3 ,1/4,do wykończenia,miejskie,garaż/miejsce parkingowe,balkon,https://www.otodom.pl/pl/oferta/komfortowe-trzypokojowe-mieszkanie-na-tarchominie-ID4nrzz,Mazowieckie,Warszawa
Unikatowy Apartament w prestiżowej części Mokotowa,3939810.0,"Białej Koniczyny, Stegny, Mokotów, Warszawa, mazowieckie",187.61,4 ,1/2,,miejskie,garaż/miejsce parkingowe,taras,https://www.otodom.pl/pl/oferta/unikatowy-apartament-w-prestizowej-czesci-mokotowa-ID4nUU9,Mazowieckie,Warszawa
Gotowe do wprowadzenia mieszkanie w Wilanowie!,990000.0,"al. Aleja Rzeczypospolitej, Błonia Wilanowskie, Wilanów, Warszawa, mazowieckie",54.5,2 ,1/4,do zamieszkania,miejskie,garaż/miejsce parkingowe,balkon,https://www.otodom.pl/pl/oferta/gotowe-do-wprowadzenia-mieszkanie-w-wilanowie-ID4nURT,Mazowieckie,Warszawa
"Super Lokalizacja 2 pok.41,1m2 Puławska róg Dolnej",720000.0,"Stary Mokotów, Mokotów, Warszawa, mazowieckie",41.1,2 ,2/7,do zamieszkania,miejskie,,,https://www.otodom.pl/pl/oferta/super-lokalizacja-2-pok-41-1m2-pulawska-rog-dolnej-ID4nURk,Mazowieckie,Warszawa
4-pokojowe mieszkanie 116m2 + ogródek Bez Prowizji,2242752.0,"ul. Figowa, Siekierki, Mokotów, Warszawa, mazowieckie",116.81,4 ,parter/2,do wykończenia,,garaż/miejsce parkingowe,"taras, ogródek",https://www.otodom.pl/pl/oferta/4-pokojowe-mieszkanie-116m2-ogrodek-bez-prowizji-ID4kgvy,Mazowieckie,Warszawa
2-pokojowe mieszkanie 38m2 + ogródek Bez Prowizji,895419.0,"ul. Białej Koniczyny/ul. Dzikich Jabłoni, Stegny, Mokotów, Warszawa, mazowieckie",38.43,2 ,parter/2,do wykończenia,,garaż/miejsce parkingowe,ogródek,https://www.otodom.pl/pl/oferta/2-pokojowe-mieszkanie-38m2-ogrodek-bez-prowizji-ID4i775,Mazowieckie,Warszawa
3-pokojowy apartament 66m2 + balkon Bezpośrednio,,"ul. Ogrodowa, Mirów, Wola, Warszawa, mazowieckie",66.88,3 ,5/6,do wykończenia,,garaż/miejsce parkingowe,balkon,https://www.otodom.pl/pl/oferta/3-pokojowy-apartament-66m2-balkon-bezposrednio-ID4l3r0,Mazowieckie,Warszawa
Designerski apartament na Mokotowie | 3 pokoje,1950000.0,"ul. Postępu, Służewiec, Mokotów, Warszawa, mazowieckie",77.0,3 ,6/8,do zamieszkania,miejskie,garaż/miejsce parkingowe,taras,https://www.otodom.pl/pl/oferta/designerski-apartament-na-mokotowie-3-pokoje-ID4nSVh,Mazowieckie,Warszawa
GOTOWE 2-pok. 42.06m2 na BEMOWIE. Kup i Zamieszkaj,76647617.0,"ul. Kopalniana, Chrzanów, Bemowo, Warszawa, mazowieckie",42.06,2 ,3/4,do wykończenia,miejskie,,,https://www.otodom.pl/pl/oferta/gotowe-2-pok-42-06m2-na-bemowie-kup-i-zamieszkaj-ID4nUHM,Mazowieckie,Warszawa
Po generalnym remoncie mieszkanie na Saskiej Kępie,880000.0,"al. Aleja Stanów Zjednoczonych, Saska Kępa, Praga-Południe, Warszawa, mazowieckie",57.0,3 ,2/10,do zamieszkania,miejskie,garaż/miejsce parkingowe,balkon,https://www.otodom.pl/pl/oferta/po-generalnym-remoncie-mieszkanie-na-saskiej-kepie-ID4nF1x,Mazowieckie,Warszawa
Metro/Targówek/2 pokoje/46m2/Balkon/Do remontu,579000.0,"ul. Krasnobrodzka, Bródno-Podgrodzie, Targówek, Warszawa, mazowieckie",46.4,2 ,2/10,,miejskie,,,https://www.otodom.pl/pl/oferta/metro-targowek-2-pokoje-46m2-balkon-do-remontu-ID4nQUs,Mazowieckie,Warszawa
"4-pok na Bemowie. GOTOWE osiedle, Kup i Zamieszkaj",162499380.0,"ul. Kopalniana, Chrzanów, Bemowo, Warszawa, mazowieckie",98.79,4 ,2/4,do wykończenia,miejskie,,,https://www.otodom.pl/pl/oferta/4-pok-na-bemowie-gotowe-osiedle-kup-i-zamieszkaj-ID4nUI8,Mazowieckie,Warszawa
"Sprzedam mieszkanie 50,7 m2 os. Greenwood",760000.0,"Luciana Pavarottiego 9, Kobiałka, Białołęka, Warszawa, mazowieckie",50.7,2 ,1/2,do zamieszkania,kotłownia,garaż/miejsce parkingowe,"balkon, taras",https://www.otodom.pl/pl/oferta/sprzedam-mieszkanie-50-7-m2-os-greenwood-ID4nUOo,Mazowieckie,Warszawa
3 pokoje na Ursynowie | ul. Na Uboczu,895000.0,"ul. Na Uboczu, Natolin, Ursynów, Warszawa, mazowieckie",66.3,3 ,3/11,do wykończenia,miejskie,,balkon,https://www.otodom.pl/pl/oferta/3-pokoje-na-ursynowie-ul-na-uboczu-ID4metS,Mazowieckie,Warszawa
Saska Kępa | 2 Pok. | Dwustronne | 2003 r.,1100000.0,"ul. Lipska, Saska Kępa, Praga-Południe, Warszawa, mazowieckie",50.8,2 ,1/3,do zamieszkania,miejskie,garaż/miejsce parkingowe,balkon,https://www.otodom.pl/pl/oferta/saska-kepa-2-pok-dwustronne-2003-r-ID4nSiy,Mazowieckie,Warszawa
"Kawalerka | Mokotów | 30,90 m2",599000.0,"ul. Maltańska, Stegny, Mokotów, Warszawa, mazowieckie",30.9,1 ,8/12,do zamieszkania,miejskie,garaż/miejsce parkingowe,balkon,https://www.otodom.pl/pl/oferta/kawalerka-mokotow-30-90-m2-ID4nOUH,Mazowieckie,Warszawa
Mieszkanie 2 Pok. | Śródmieście | 5 Piętro,1250000.0,"ul. Nowogrodzka, Śródmieście Południowe, Śródmieście, Warszawa, mazowieckie",57.05,2 ,5/6,do remontu,miejskie,garaż/miejsce parkingowe,balkon,https://www.otodom.pl/pl/oferta/mieszkanie-2-pok-srodmiescie-5-pietro-ID4nRT1,Mazowieckie,Warszawa
"2 pokoje mieszkanie w sercu Saskiej Kępy | 57,71m2",1075000.0,"al. Aleja Jerzego Waszyngtona, Saska Kępa, Praga-Południe, Warszawa, mazowieckie",57.71,2 ,7/14,do zamieszkania,miejskie,garaż/miejsce parkingowe,balkon,https://www.otodom.pl/pl/oferta/2-pokoje-mieszkanie-w-sercu-saskiej-kepy-57-71m2-ID4n06s,Mazowieckie,Warszawa
Rezydencja Niska | 2pok | Luksusowy Apartament,1400000.0,"ul. Niska, Nowolipki, Wola, Warszawa, mazowieckie",54.0,2 ,2/3,do zamieszkania,miejskie,,,https://www.otodom.pl/pl/oferta/rezydencja-niska-2pok-luksusowy-apartament-ID4iKf1,Mazowieckie,Warszawa
"Ciche,Po Remoncie, Garaż, Metro!!",1559000.0,"al. Aleja Wilanowska, Stegny, Mokotów, Warszawa, mazowieckie",106.5,3 ,1/2,do zamieszkania,gazowe,garaż/miejsce parkingowe,balkon,https://www.otodom.pl/pl/oferta/ciche-po-remoncie-garaz-metro-ID4lOYV,Mazowieckie,Warszawa
"Bezpośrednio nowe wykończone 63,8m2 ul Przy Forcie",937566.0,"ul. Przy Forcie 12 B, Skorosze, Ursus, Warszawa, mazowieckie",63.78,3 ,5/6,do zamieszkania,kotłownia,garaż/miejsce parkingowe,balkon,https://www.otodom.pl/pl/oferta/bezposrednio-nowe-wykonczone-63-8m2-ul-przy-forcie-ID4manR,Mazowieckie,Warszawa
Zaciszne I Komfortowe Mieszkanie Na Białołęce !,650000.0,"ul. Przylesie, Dąbrówka Szlachecka, Białołęka, Warszawa, mazowieckie",65.6,2 ,4/4,do zamieszkania,miejskie,,balkon,https://www.otodom.pl/pl/oferta/zaciszne-i-komfortowe-mieszkanie-na-bialolece-ID4lFBS,Mazowieckie,Warszawa
Kameralne mieszkanie bezczynszowe Stary Rembertów,967777.0,"ul. Magenta / Listonoszy, Stary Rembertów, Rembertów, Warszawa, mazowieckie",103.0,4 ,1/2,do wykończenia,gazowe,garaż/miejsce parkingowe,"balkon, taras",https://www.otodom.pl/pl/oferta/kameralne-mieszkanie-bezczynszowe-stary-rembertow-ID4cPz9,Mazowieckie,Warszawa
nowe/dwa pokoje/przy metrze Natolin/bezpośrednio,819000.0,"ul. Henryka Raabego 15, Natolin, Ursynów, Warszawa, mazowieckie",32.12,2 ,7/10,do wykończenia,miejskie,garaż/miejsce parkingowe,balkon,https://www.otodom.pl/pl/oferta/nowe-dwa-pokoje-przy-metrze-natolin-bezposrednio-ID4nIlY,Mazowieckie,Warszawa
Mieszkanie w apartamentowcu na Mokotowie,999000.0,"ul. Zygmunta Modzelewskiego, Służew, Mokotów, Warszawa, mazowieckie",54.3,2 ,3/7,do zamieszkania,miejskie,garaż/miejsce parkingowe,balkon,https://www.otodom.pl/pl/oferta/mieszkanie-w-apartamentowcu-na-mokotowie-ID4nUOh,Mazowieckie,Warszawa
Świetna Lokalizacja obok metro Natolin 84m2 4 pok.,1190000.0,"Natolin, Ursynów, Warszawa, mazowieckie",84.0,4 ,1/3,do zamieszkania,miejskie,,balkon,https://www.otodom.pl/pl/oferta/swietna-lokalizacja-obok-metro-natolin-84m2-4-pok-ID4nUOb,Mazowieckie,Warszawa
Dla inwestora 2 pok. Stare Miasto!,749000.0,"Muranów, Śródmieście, Warszawa, mazowieckie",35.0,2 ,3/4,do zamieszkania,miejskie,,balkon,https://www.otodom.pl/pl/oferta/dla-inwestora-2-pok-stare-miasto-ID4nPn4,Mazowieckie,Warszawa
"Nowe 3-pokojowe mieszkanie na Bemowie, 2 balkony",1273376.0,"ul. Marynin, Górce, Bemowo, Warszawa, mazowieckie",90.24,4 ,3/5,do wykończenia,,garaż/miejsce parkingowe,,https://www.otodom.pl/pl/oferta/nowe-3-pokojowe-mieszkanie-na-bemowie-2-balkony-ID4moEZ,Mazowieckie,Warszawa
Nowe 3-pokojowe mieszkanie Warszawa Targówek,761492.0,"Targówek Mieszkaniowy, Targówek, Warszawa, mazowieckie",59.96,3 ,2/8,do wykończenia,,,,https://www.otodom.pl/pl/oferta/nowe-3-pokojowe-mieszkanie-warszawa-targowek-ID4mPlz,Mazowieckie,Warszawa
Stylowa kawalerka 27 m2 na Bemowie,560000.0,"ul. Człuchowska, Jelonki Północne, Bemowo, Warszawa, mazowieckie",27.0,1 ,7/14,do zamieszkania,miejskie,,balkon,https://www.otodom.pl/pl/oferta/stylowa-kawalerka-27-m2-na-bemowie-ID4nIXp,Mazowieckie,Warszawa
"Klimatyczne Mieszkanie W Kamienicy 3,80 M Wysokośc",2860000.0,"Śródmieście Południowe, Śródmieście, Warszawa, mazowieckie",110.0,5 ,4/5,do remontu,miejskie,,balkon,https://www.otodom.pl/pl/oferta/klimatyczne-mieszkanie-w-kamienicy-3-80-m-wysokosc-ID4mLni,Mazowieckie,Warszawa
Nowoczesne mieszkanie pl. Zbawiciela bezpośrednio,2300000.0,"Marszałkowska 27/35, Śródmieście Południowe, Śródmieście, Warszawa, mazowieckie",96.32,5 ,3/5,do zamieszkania,miejskie,garaż/miejsce parkingowe,,https://www.otodom.pl/pl/oferta/nowoczesne-mieszkanie-pl-zbawiciela-bezposrednio-ID4mwMg,Mazowieckie,Warszawa
Dwa pokoje na Bielanach blisko Metra,900000.0,"Słodowiec, Bielany, Warszawa, mazowieckie",50.5,2 ,2/3,do zamieszkania,miejskie,,balkon,https://www.otodom.pl/pl/oferta/dwa-pokoje-na-bielanach-blisko-metra-ID4nBPC,Mazowieckie,Warszawa
"Duża kawalerka z balkonem, Rondo Wiatraczna",630000.0,"Grochów, Praga-Południe, Warszawa, mazowieckie",40.3,1 ,4/10,do zamieszkania,miejskie,,balkon,https://www.otodom.pl/pl/oferta/duza-kawalerka-z-balkonem-rondo-wiatraczna-ID4nIEH,Mazowieckie,Warszawa
"2 pok. z balkonem, Powiśle.",719000.0,"Solec, Śródmieście, Warszawa, mazowieckie",39.0,2 ,4/10,do zamieszkania,miejskie,,balkon,https://www.otodom.pl/pl/oferta/2-pok-z-balkonem-powisle-ID4nPn5,Mazowieckie,Warszawa
"Mieszkanie, 70 m², Warszawa",1015000.0,"Stara Miłosna, Wesoła, Warszawa, mazowieckie",70.0,3 ,2/2,do zamieszkania,miejskie,garaż/miejsce parkingowe,balkon,https://www.otodom.pl/pl/oferta/mieszkanie-70-m-warszawa-ID4nzXF,Mazowieckie,Warszawa
1-pokojowe mieszkanie 30m2 + balkon Bez Prowizji,530300.0,"ul. Optyków, Gocław, Praga-Południe, Warszawa, mazowieckie",30.2,1 ,4/5,do wykończenia,,garaż/miejsce parkingowe,balkon,https://www.otodom.pl/pl/oferta/1-pokojowe-mieszkanie-30m2-balkon-bez-prowizji-ID4i0dN,Mazowieckie,Warszawa
