Title,Price,Location,Surface,Number_of_Rooms,Floor,Finishing_Condition,Heating,Parking_Space,Balcony_Garden_Terrace,Link,Voivodeship,City
Właściciel- Ludwiki DD - WIDOK NA ZIELEŃ - 2x gar,2499000.0,"ul. Ludwiki, Czyste, Wola, Warszawa, mazowieckie",105.0,4 ,2/8,do wykończenia,miejskie,garaż/miejsce parkingowe,balkon,https://www.otodom.pl/pl/oferta/wlasciciel-ludwiki-dd-widok-na-zielen-2x-gar-ID4mYBj,Mazowieckie,Warszawa
Mieszkanie 2 pokojowe przy ul. Rosoła,610000.0,"ul. Jana Rosoła, Natolin, Ursynów, Warszawa, mazowieckie",42.0,2 ,8/12,do remontu,,,balkon,https://www.otodom.pl/pl/oferta/mieszkanie-2-pokojowe-przy-ul-rosola-ID4nWlw,Mazowieckie,Warszawa
"3 pokoje Apartament Ursynów, ul. Polki 1",999999.0,"Pyry, Ursynów, Warszawa, mazowieckie",63.95,3 ,1/3,do zamieszkania,miejskie,garaż/miejsce parkingowe,balkon,https://www.otodom.pl/pl/oferta/3-pokoje-apartament-ursynow-ul-polki-1-ID4nLYC,Mazowieckie,Warszawa
"Bezpośrednio 2 pokoje 37,8m2 Ursus, ul. Keniga",522000.0,"Niedźwiadek, Ursus, Warszawa, mazowieckie",37.8,2 ,parter/4,do remontu,miejskie,,,https://www.otodom.pl/pl/oferta/bezposrednio-2-pokoje-37-8m2-ursus-ul-keniga-ID4nWlr,Mazowieckie,Warszawa
"Osiedle Wilno, mieszkanie 65 m2, 3-pokojowe",900000.0,"ul. Montwiłłowska 4, Elsnerów, Targówek, Warszawa, mazowieckie",64.64,3 ,2/3,do zamieszkania,miejskie,garaż/miejsce parkingowe,balkon,https://www.otodom.pl/pl/oferta/osiedle-wilno-mieszkanie-65-m2-3-pokojowe-ID4nx0O,Mazowieckie,Warszawa
"Mieszkanie, 28,12 m², Warszawa",560000.0,"ul. Karola Dickensa, Szczęśliwice, Ochota, Warszawa, mazowieckie",28.12,1 ,2/7,,,,,https://www.otodom.pl/pl/oferta/mieszkanie-28-12-m-warszawa-ID4nWlh,Mazowieckie,Warszawa
Wspaniała lokalizacja w sercu Ochoty-bezpośrednio!,636000.0,"ul. Grójecka, Stara Ochota, Ochota, Warszawa, mazowieckie",37.0,2 ,2/14,do zamieszkania,miejskie,,balkon,https://www.otodom.pl/pl/oferta/wspaniala-lokalizacja-w-sercu-ochoty-bezposrednio-ID4nWjS,Mazowieckie,Warszawa
"Mieszkanie, 38,56 m², Warszawa",675000.0,"Saska Kępa, Praga-Południe, Warszawa, mazowieckie",38.56,2 ,3/10,,miejskie,,balkon,https://www.otodom.pl/pl/oferta/mieszkanie-38-56-m-warszawa-ID4nWjH,Mazowieckie,Warszawa
"Apartament z widokiem na Wisłe, obok Elektrowni",2500000.0,"ul. Wybrzeże Kościuszkowskie, Powiśle, Śródmieście, Warszawa, mazowieckie",78.0,2 ,1/5,do zamieszkania,,garaż/miejsce parkingowe,taras,https://www.otodom.pl/pl/oferta/apartament-z-widokiem-na-wisle-obok-elektrowni-ID4nSAF,Mazowieckie,Warszawa
"Wyjątkowy apartament przy Nowym Świecie,ul.Okólnik",5490000.0,"ul. Okólnik, Śródmieście Północne, Śródmieście, Warszawa, mazowieckie",190.0,4 ,4/6,do zamieszkania,,,,https://www.otodom.pl/pl/oferta/wyjatkowy-apartament-przy-nowym-swiecie-ul-okolnik-ID4nSAH,Mazowieckie,Warszawa
"EXCLUSIVE 3 pokoje, Loggia, BEZPOŚREDNIO!",1267000.0,"ul. Sarmacka, Błonia Wilanowskie, Wilanów, Warszawa, mazowieckie",65.0,3 ,2/4,do zamieszkania,miejskie,,balkon,https://www.otodom.pl/pl/oferta/exclusive-3-pokoje-loggia-bezposrednio-ID4nJc7,Mazowieckie,Warszawa
Trzy pokoje na Bielanach - możliwy kredyt 2%,649900.0,"ul. Wrzeciono, Wrzeciono, Bielany, Warszawa, mazowieckie",53.5,3 ,parter/4,do remontu,miejskie,,,https://www.otodom.pl/pl/oferta/trzy-pokoje-na-bielanach-mozliwy-kredyt-2-ID4nWj0,Mazowieckie,Warszawa
Rozkładowe 2 pokoje z widną kuchnią pod KREDYT 2%,690000.0,"ul. Posag 7 Panien 16, Szamoty, Ursus, Warszawa, mazowieckie",41.95,2 ,3/7,do zamieszkania,miejskie,,balkon,https://www.otodom.pl/pl/oferta/rozkladowe-2-pokoje-z-widna-kuchnia-pod-kredyt-2-ID47IzE,Mazowieckie,Warszawa
Idealne pod kredyt 2% | Dwa balkony | Top widok,739000.0,"ul. Sienna, Mirów, Wola, Warszawa, mazowieckie",37.0,2 ,7/9,do zamieszkania,,garaż/miejsce parkingowe,balkon,https://www.otodom.pl/pl/oferta/idealne-pod-kredyt-2-dwa-balkony-top-widok-ID4nO5D,Mazowieckie,Warszawa
"3 pokoje z ogródkiem, Żoliborz, Przasnyska",1550000.0,"ul. Przasnyska, Sady Żoliborskie, Żoliborz, Warszawa, mazowieckie",64.0,3 ,parter/6,do zamieszkania,miejskie,garaż/miejsce parkingowe,"ogródek, taras",https://www.otodom.pl/pl/oferta/3-pokoje-z-ogrodkiem-zoliborz-przasnyska-ID4nWiL,Mazowieckie,Warszawa
"Mieszkanie 42,5 m2 z komórką i miejscem garażowym",700000.0,"ul. gen. Felicjana Sławoja Składkowskiego, Skorosze, Ursus, Warszawa, mazowieckie",42.5,3 ,4/6,do zamieszkania,miejskie,garaż/miejsce parkingowe,balkon,https://www.otodom.pl/pl/oferta/mieszkanie-42-5-m2-z-komorka-i-miejscem-garazowym-ID4nWiM,Mazowieckie,Warszawa
Dywizjonu * 2 Balkony * Garaż * Rozkładowe * Kw,1095000.0,"Górce, Bemowo, Warszawa, mazowieckie",69.1,3 ,1/3,do zamieszkania,,garaż/miejsce parkingowe,balkon,https://www.otodom.pl/pl/oferta/dywizjonu-2-balkony-garaz-rozkladowe-kw-ID4nWiP,Mazowieckie,Warszawa
Mieszkanie w Otoczeniu 3 Parków - Zielona Okolica,579000.0,"Wierzbno, Mokotów, Warszawa, mazowieckie",36.3,2 ,parter/12,,miejskie,,,https://www.otodom.pl/pl/oferta/mieszkanie-w-otoczeniu-3-parkow-zielona-okolica-ID4nWiQ,Mazowieckie,Warszawa
3-pokojowe mieszkanie Żoliborz / bezpośrednio,1500000.0,"ul. Ludwika Rydygiera, Sady Żoliborskie, Żoliborz, Warszawa, mazowieckie",64.8,3 ,1/14,,,garaż/miejsce parkingowe,,https://www.otodom.pl/pl/oferta/3-pokojowe-mieszkanie-zoliborz-bezposrednio-ID4nvZR,Mazowieckie,Warszawa
"Apartament w paryskim stylu, Centrum",1950000.0,"ul. Poznańska, Śródmieście Południowe, Śródmieście, Warszawa, mazowieckie",54.13,2 ,3/5,,,,balkon,https://www.otodom.pl/pl/oferta/apartament-w-paryskim-stylu-centrum-ID4nRJX,Mazowieckie,Warszawa
Penthouse z dużym tarasem i widokiem na Warszawę,7000000.0,"ul. Grzybowska, Mirów, Wola, Warszawa, mazowieckie",198.0,4 ,> 10/22,,,,taras,https://www.otodom.pl/pl/oferta/penthouse-z-duzym-tarasem-i-widokiem-na-warszawe-ID4nsjH,Mazowieckie,Warszawa
Przy Parku Szczęśliwickim | 3 miejsca parkingowe,4500000.0,"ul. Maszynowa, Szczęśliwice, Ochota, Warszawa, mazowieckie",115.0,4 ,3/3,do zamieszkania,,garaż/miejsce parkingowe,taras,https://www.otodom.pl/pl/oferta/przy-parku-szczesliwickim-3-miejsca-parkingowe-ID4n5vk,Mazowieckie,Warszawa
"Apartament Zlota 44, 2 sypialnie, 2 łazienki",5500000.0,"ul. Złota, Śródmieście Północne, Śródmieście, Warszawa, mazowieckie",92.0,3 ,> 10/52,,,garaż/miejsce parkingowe,,https://www.otodom.pl/pl/oferta/apartament-zlota-44-2-sypialnie-2-lazienki-ID4ni6x,Mazowieckie,Warszawa
"REMBERTÓW 32m2+ piwnica, Przy stacji SKM",499000.0,"ul. Cyrulików 75, Stary Rembertów, Rembertów, Warszawa, mazowieckie",32.0,1 ,parter/3,do zamieszkania,kotłownia,garaż/miejsce parkingowe,balkon,https://www.otodom.pl/pl/oferta/rembertow-32m2-piwnica-przy-stacji-skm-ID4nc4S,Mazowieckie,Warszawa
2 Pokoje Z Widokiem - Blisko Metra - Na Kredyt 2 %,654900.0,"ul. Secemińska, Bemowo-Lotnisko, Bemowo, Warszawa, mazowieckie",47.0,2 ,6/7,do zamieszkania,miejskie,garaż/miejsce parkingowe,,https://www.otodom.pl/pl/oferta/2-pokoje-z-widokiem-blisko-metra-na-kredyt-2-ID4nAy0,Mazowieckie,Warszawa
"4 pokoje 70,4 m2 , Warszawa Ursynów",799000.0,"ul. Czesława Przybylskiego, Ursynów-Centrum, Ursynów, Warszawa, mazowieckie",70.4,4 ,3/4,do remontu,miejskie,,balkon,https://www.otodom.pl/pl/oferta/4-pokoje-70-4-m2-warszawa-ursynow-ID4npWQ,Mazowieckie,Warszawa
"2 pokoje 51 m2, 5 min do SKM",619000.0,"ul. Grawerska, Nowy Rembertów, Rembertów, Warszawa, mazowieckie",51.1,2 ,2/3,do zamieszkania,miejskie,,balkon,https://www.otodom.pl/pl/oferta/2-pokoje-51-m2-5-min-do-skm-ID4nqoi,Mazowieckie,Warszawa
3 pokoje I 2 balkony I metro,1600000.0,"Stary Imielin, Ursynów, Warszawa, mazowieckie",83.0,4 ,4/7,,miejskie,,,https://www.otodom.pl/pl/oferta/3-pokoje-i-2-balkony-i-metro-ID4nWih,Mazowieckie,Warszawa
"NOWE Bez PCC Wysokość 3,5m Ogród 147m2 Metro Wola",1702730.0,"Czyste, Wola, Warszawa, mazowieckie",83.06,4 ,parter/5,do wykończenia,miejskie,garaż/miejsce parkingowe,"ogródek, taras",https://www.otodom.pl/pl/oferta/nowe-bez-pcc-wysokosc-3-5m-ogrod-147m2-metro-wola-ID4nFRk,Mazowieckie,Warszawa
Lux apartament na Warszawskim Powiślu,1600000.0,"Solec, Śródmieście, Warszawa, mazowieckie",59.83,2 ,1/12,,miejskie,garaż/miejsce parkingowe,taras,https://www.otodom.pl/pl/oferta/lux-apartament-na-warszawskim-powislu-ID4mE6w,Mazowieckie,Warszawa
Okazja Cenowa!!!4 Pok Plus Strych,760000.0,"Skorosze, Ursus, Warszawa, mazowieckie",94.3,4 ,3/3,do remontu,gazowe,,,https://www.otodom.pl/pl/oferta/okazja-cenowa-4-pok-plus-strych-ID4nE3X,Mazowieckie,Warszawa
4 pokoje / msc. parkingowe/ Metro Wilanowska,865000.0,"Służew, Mokotów, Warszawa, mazowieckie",56.0,4 ,3/10,do zamieszkania,inne,garaż/miejsce parkingowe,balkon,https://www.otodom.pl/pl/oferta/4-pokoje-msc-parkingowe-metro-wilanowska-ID4nI7v,Mazowieckie,Warszawa
"Komfortowe, nowe 3 pokoje 74m2 z pięknym widokiem",1180000.0,"Wierzbno, Mokotów, Warszawa, mazowieckie",73.48,3 ,4/4,,miejskie,garaż/miejsce parkingowe,balkon,https://www.otodom.pl/pl/oferta/komfortowe-nowe-3-pokoje-74m2-z-pieknym-widokiem-ID4npZM,Mazowieckie,Warszawa
2-pokojowe mieszkanie deweloperskie Ursus Skorosze,477000.0,"Czechowice, Ursus, Warszawa, mazowieckie",29.5,2 ,,,,,,https://www.otodom.pl/pl/oferta/2-pokojowe-mieszkanie-deweloperskie-ursus-skorosze-ID4ngPy,Mazowieckie,Warszawa
Apartament z Garażem i tarasem Cicho i super miejs,798000.0,"ul. Czapelska, Grochów, Praga-Południe, Warszawa, mazowieckie",48.0,2 ,1/7,,miejskie,garaż/miejsce parkingowe,taras,https://www.otodom.pl/pl/oferta/apartament-z-garazem-i-tarasem-cicho-i-super-miejs-ID4nWh6,Mazowieckie,Warszawa
nowoczesne | 2 pokoje | wyposażone,799000.0,"ul. Marii Rodziewiczówny, Gocławek, Praga-Południe, Warszawa, mazowieckie",49.33,2 ,2/25,do zamieszkania,miejskie,garaż/miejsce parkingowe,balkon,https://www.otodom.pl/pl/oferta/nowoczesne-2-pokoje-wyposazone-ID4iU81,Mazowieckie,Warszawa
Kawalerka | 35 m2 | Ursynów,579000.0,"Ursynów-Centrum, Ursynów, Warszawa, mazowieckie",34.45,1 ,parter/4,do zamieszkania,miejskie,,,https://www.otodom.pl/pl/oferta/kawalerka-35-m2-ursynow-ID4nA12,Mazowieckie,Warszawa
Ursynów 4 Pokoje gotowe do zamieszkania !,997650.0,"ul. Aleksandra Janowskiego, Ursynów Północny, Ursynów, Warszawa, mazowieckie",73.9,4 ,3/3,do zamieszkania,,garaż/miejsce parkingowe,balkon,https://www.otodom.pl/pl/oferta/ursynow-4-pokoje-gotowe-do-zamieszkania-ID4n0gy,Mazowieckie,Warszawa
Nowoczesny apartament o wysokim standardzie,1400000.0,"Czechowice, Ursus, Warszawa, mazowieckie",80.0,2 ,6/6,do zamieszkania,miejskie,garaż/miejsce parkingowe,balkon,https://www.otodom.pl/pl/oferta/nowoczesny-apartament-o-wysokim-standardzie-ID4nJaK,Mazowieckie,Warszawa
Warszawa-Wawer | 3 pokoje | blisko PKP,849000.0,"Falenica, Wawer, Warszawa, mazowieckie",58.36,3 ,1/5,do wykończenia,miejskie,garaż/miejsce parkingowe,balkon,https://www.otodom.pl/pl/oferta/warszawa-wawer-3-pokoje-blisko-pkp-ID4nD9s,Mazowieckie,Warszawa
2 pokoje_antresola_2tarasy/ Developer bezpośrednio,1486000.0,"Białołęka Dworska, Białołęka, Warszawa, mazowieckie",103.5,2 ,2/3,do wykończenia,miejskie,garaż/miejsce parkingowe,"balkon, taras",https://www.otodom.pl/pl/oferta/2-pokoje-antresola-2tarasy-developer-bezposrednio-ID4nWgL,Mazowieckie,Warszawa
Mieszkanie 3/4 Pokojowe - Rozkładowe i Jasne,900000.0,"ul. Dedala, Gocław, Praga-Południe, Warszawa, mazowieckie",87.1,4 ,4/4,do wykończenia,,,taras,https://www.otodom.pl/pl/oferta/mieszkanie-3-4-pokojowe-rozkladowe-i-jasne-ID4npFl,Mazowieckie,Warszawa
Przestronne Mieszkanie w zielonej okolicy.,749000.0,"ul. Ogórkowa, Nadwiśle, Wawer, Warszawa, mazowieckie",69.0,3 ,1/1,do zamieszkania,kotłownia,garaż/miejsce parkingowe,"balkon, ogródek",https://www.otodom.pl/pl/oferta/przestronne-mieszkanie-w-zielonej-okolicy-ID4nooV,Mazowieckie,Warszawa
"Apartament z basenem - Wola, Jana Kaziemierza",849000.0,"ul. Jana Kazimierza, Odolany, Wola, Warszawa, mazowieckie",41.2,2 ,4/6,do zamieszkania,miejskie,garaż/miejsce parkingowe,balkon,https://www.otodom.pl/pl/oferta/apartament-z-basenem-wola-jana-kaziemierza-ID4nN9P,Mazowieckie,Warszawa
3 pokoje_balkon #0PCC + Developer,822000.0,"Białołęka Dworska, Białołęka, Warszawa, mazowieckie",66.5,3 ,1/3,do wykończenia,miejskie,garaż/miejsce parkingowe,balkon,https://www.otodom.pl/pl/oferta/3-pokoje-balkon-0pcc-developer-ID4nWgm,Mazowieckie,Warszawa
"Dwa pokoje Solec 115, 2 piętro, winda, ciche",720000.0,"ul. Solec, Solec, Śródmieście, Warszawa, mazowieckie",36.0,2 ,2/8,do zamieszkania,miejskie,garaż/miejsce parkingowe,"balkon, ogródek",https://www.otodom.pl/pl/oferta/dwa-pokoje-solec-115-2-pietro-winda-ciche-ID4nJak,Mazowieckie,Warszawa
3 pokojowe mieszkanie z garażem i balkonem,799000.0,"Mariana Wyrzykowskiego, Nowodwory, Białołęka, Warszawa, mazowieckie",59.0,3 ,3/5,do zamieszkania,miejskie,garaż/miejsce parkingowe,balkon,https://www.otodom.pl/pl/oferta/3-pokojowe-mieszkanie-z-garazem-i-balkonem-ID4nN9B,Mazowieckie,Warszawa
"Miasteczko Wilanów, 2pok, gotowe z meblami",849000.0,"al. Aleja Rzeczypospolitej 33a, Błonia Wilanowskie, Wilanów, Warszawa, mazowieckie",41.73,2 ,1/4,do zamieszkania,miejskie,garaż/miejsce parkingowe,"balkon, taras",https://www.otodom.pl/pl/oferta/miasteczko-wilanow-2pok-gotowe-z-meblami-ID4nooI,Mazowieckie,Warszawa
Mieszkanie 3-pokojowe 61.5m - bliska Białołęka,879000.0,"ul. Głębocka 115, Grodzisk, Białołęka, Warszawa, mazowieckie",61.5,3 ,2/4,do zamieszkania,miejskie,garaż/miejsce parkingowe,balkon,https://www.otodom.pl/pl/oferta/mieszkanie-3-pokojowe-61-5m-bliska-bialoleka-ID4nJa7,Mazowieckie,Warszawa
3-pokojowe mieszkanie 66m2 + ogródek Bezpośrednio,1421602.0,"ul. Białej Koniczyny/ul. Dzikich Jabłoni, Stegny, Mokotów, Warszawa, mazowieckie",66.43,3 ,parter/2,do wykończenia,,garaż/miejsce parkingowe,ogródek,https://www.otodom.pl/pl/oferta/3-pokojowe-mieszkanie-66m2-ogrodek-bezposrednio-ID4i0sv,Mazowieckie,Warszawa
"Bez Prowizji, Bez Pcc, Rynek Pierwotny",577908.0,"ul. Warszawska, Niedźwiadek, Ursus, Warszawa, mazowieckie",53.51,3 ,2/2,do wykończenia,inne,garaż/miejsce parkingowe,balkon,https://www.otodom.pl/pl/oferta/bez-prowizji-bez-pcc-rynek-pierwotny-ID4nCDZ,Mazowieckie,Warszawa
3 pokoje_baklon/developer_bezpośrednio,832000.0,"Białołęka Dworska, Białołęka, Warszawa, mazowieckie",67.0,3 ,2/3,,miejskie,garaż/miejsce parkingowe,balkon,https://www.otodom.pl/pl/oferta/3-pokoje-baklon-developer-bezposrednio-ID4nWfS,Mazowieckie,Warszawa
Pełne uroku mieszkanie z widokiem na Wisłę,619000.0,"ul. Górnośląska, Solec, Śródmieście, Warszawa, mazowieckie",30.0,2 ,9/15,do zamieszkania,miejskie,,balkon,https://www.otodom.pl/pl/oferta/pelne-uroku-mieszkanie-z-widokiem-na-wisle-ID4nObK,Mazowieckie,Warszawa
Mieszkanie 77m2 3/4 pokoje Górce Bemowo,950000.0,"Górce, Bemowo, Warszawa, mazowieckie",77.0,3 ,5/10,do remontu,miejskie,,balkon,https://www.otodom.pl/pl/oferta/mieszkanie-77m2-3-4-pokoje-gorce-bemowo-ID4nWft,Mazowieckie,Warszawa
4-pokojowe mieszkanie 80m2 + loggia Bezpośrednio,1632500.0,"ul. Białej Koniczyny/ul. Dzikich Jabłoni, Stegny, Mokotów, Warszawa, mazowieckie",80.32,4 ,1/2,do wykończenia,,garaż/miejsce parkingowe,,https://www.otodom.pl/pl/oferta/4-pokojowe-mieszkanie-80m2-loggia-bezposrednio-ID4i0sz,Mazowieckie,Warszawa
Wyposażenie w cenie| Do wejścia| Dużo zieleni,830000.0,"ul. Okocimska, Ulrychów, Wola, Warszawa, mazowieckie",49.81,3 ,4/10,do zamieszkania,miejskie,,,https://www.otodom.pl/pl/oferta/wyposazenie-w-cenie-do-wejscia-duzo-zieleni-ID4nWf5,Mazowieckie,Warszawa
Widne 3 -pokojowe po generalnym remoncie metro Bró,997000.0,"ul. Wyszogrodzka, Bródno, Targówek, Warszawa, mazowieckie",67.13,3 ,3/17,do zamieszkania,miejskie,,balkon,https://www.otodom.pl/pl/oferta/widne-3-pokojowe-po-generalnym-remoncie-metro-bro-ID4nqLi,Mazowieckie,Warszawa
3 pokoje_baklon_taras #0pcc DEVELOPER!,1035000.0,"Białołęka Dworska, Białołęka, Warszawa, mazowieckie",81.0,3 ,3/3,do wykończenia,miejskie,garaż/miejsce parkingowe,"balkon, taras",https://www.otodom.pl/pl/oferta/3-pokoje-baklon-taras-0pcc-developer-ID4nWeB,Mazowieckie,Warszawa
"ul. Reymonta 17 | 66,20 m2 | 10 p | do zamieszkani",699000.0,"al. Aleja Władysława Reymonta 17, Chomiczówka, Bielany, Warszawa, mazowieckie",66.2,3 ,10/10,do zamieszkania,miejskie,garaż/miejsce parkingowe,,https://www.otodom.pl/pl/oferta/ul-reymonta-17-66-20-m2-10-p-do-zamieszkani-ID4nonc,Mazowieckie,Warszawa
4 pokoje / loggia / 2x garaż / komórka /Holm House,1499000.0,"ul. Mariana Zdziechowskiego, Ksawerów, Mokotów, Warszawa, mazowieckie",78.0,4 ,1/6,do wykończenia,miejskie,garaż/miejsce parkingowe,balkon,https://www.otodom.pl/pl/oferta/4-pokoje-loggia-2x-garaz-komorka-holm-house-ID4nWez,Mazowieckie,Warszawa
"Bezpośrednio 3 pokoje, 2 miejsca parkingowe",859999.0,"Marysin Wawerski, Wawer, Warszawa, mazowieckie",63.0,3 ,5/5,do zamieszkania,miejskie,garaż/miejsce parkingowe,balkon,https://www.otodom.pl/pl/oferta/bezposrednio-3-pokoje-2-miejsca-parkingowe-ID4mmkO,Mazowieckie,Warszawa
3-pokojowe mieszkanie 63m2 + balkon Bezpośrednio,868224.0,"ul. Przedpole, Raków, Włochy, Warszawa, mazowieckie",63.84,3 ,1/4,do wykończenia,,garaż/miejsce parkingowe,balkon,https://www.otodom.pl/pl/oferta/3-pokojowe-mieszkanie-63m2-balkon-bezposrednio-ID4izrL,Mazowieckie,Warszawa
Trzypokojowe mieszkanie Śródmieście,1500000.0,"ul. Tamka, Śródmieście Północne, Śródmieście, Warszawa, mazowieckie",66.08,3 ,> 10/14,do remontu,miejskie,,,https://www.otodom.pl/pl/oferta/trzypokojowe-mieszkanie-srodmiescie-ID4nx0y,Mazowieckie,Warszawa
"Bezpośrednio! Białołęka, 4pokoje, 95m2",1260000.0,"ul. Wiśniowy Sad, Brzeziny, Białołęka, Warszawa, mazowieckie",95.1,4 ,1/2,do zamieszkania,miejskie,garaż/miejsce parkingowe,taras,https://www.otodom.pl/pl/oferta/bezposrednio-bialoleka-4pokoje-95m2-ID4nWek,Mazowieckie,Warszawa
4 Pokojowe Mieszkanie - Oaza Spokoju i Wygody.,984700.0,"ul. Teodora Axentowicza, Anin, Wawer, Warszawa, mazowieckie",82.2,4 ,2/4,do zamieszkania,miejskie,,balkon,https://www.otodom.pl/pl/oferta/4-pokojowe-mieszkanie-oaza-spokoju-i-wygody-ID4nWcK,Mazowieckie,Warszawa
5-pokojowe mieszkanie 134m2 + taras Bezpośrednio,2822820.0,"ul. Figowa, Siekierki, Mokotów, Warszawa, mazowieckie",134.42,5 ,2/2,do wykończenia,,garaż/miejsce parkingowe,taras,https://www.otodom.pl/pl/oferta/5-pokojowe-mieszkanie-134m2-taras-bezposrednio-ID4meeM,Mazowieckie,Warszawa
"Nowe, stylowe 3 pok. mieszkanie premium Siennicka",960000.0,"ul. Siennicka, Grochów, Praga-Południe, Warszawa, mazowieckie",49.0,3 ,parter/5,do zamieszkania,miejskie,garaż/miejsce parkingowe,"balkon, taras",https://www.otodom.pl/pl/oferta/nowe-stylowe-3-pok-mieszkanie-premium-siennicka-ID4nomH,Mazowieckie,Warszawa
4-pokojowy apartament 124m2 + loggia,,"ul. Ogrodowa, Mirów, Wola, Warszawa, mazowieckie",124.49,4 ,6/6,do wykończenia,,garaż/miejsce parkingowe,,https://www.otodom.pl/pl/oferta/4-pokojowy-apartament-124m2-loggia-ID4l3ri,Mazowieckie,Warszawa
2 pokoje_stan deweloperski_od ręki_bez PCC,756000.0,"ul. Szczęsna 1A, Stare Włochy, Włochy, Warszawa, mazowieckie",50.4,2 ,1/2,do wykończenia,miejskie,,,https://www.otodom.pl/pl/oferta/2-pokoje-stan-deweloperski-od-reki-bez-pcc-ID4nWdP,Mazowieckie,Warszawa
2 pokoje przy Rondzie Wiatraczna | do wprowadzenia,745000.0,"Grochów, Praga-Południe, Warszawa, mazowieckie",46.7,2,6/7,do zamieszkania,miejskie,,balkon,https://www.otodom.pl/pl/oferta/2-pokoje-przy-rondzie-wiatraczna-do-wprowadzenia-ID4nTFl,Mazowieckie,Warszawa
3-pokojowe mieszkanie 89m2 + 2 balkony,,"ul. Dionizosa, Nowodwory, Białołęka, Warszawa, mazowieckie",89.84,3,3/8,do wykończenia,,garaż/miejsce parkingowe,balkon,https://www.otodom.pl/pl/oferta/3-pokojowe-mieszkanie-89m2-2-balkony-ID4cscO,Mazowieckie,Warszawa
"Kameralny,Widny,Cichy Apartament,4pok.79m2+Taras",1297000.0,"al. Aleja Wilanowska, Stegny, Mokotów, Warszawa, mazowieckie",79.3,4,3/4,,miejskie,garaż/miejsce parkingowe,taras,https://www.otodom.pl/pl/oferta/kameralny-widny-cichy-apartament-4pok-79m2-taras-ID4nUWs,Mazowieckie,Warszawa
"Elegancki,Widny,Cichy Apartament,4pok.79m2+Taras",1297000.0,"al. Aleja Wilanowska, Stegny, Mokotów, Warszawa, mazowieckie",79.3,4,3/4,,miejskie,garaż/miejsce parkingowe,taras,https://www.otodom.pl/pl/oferta/elegancki-widny-cichy-apartament-4pok-79m2-taras-ID4nUWq,Mazowieckie,Warszawa
Apartament z Loggią w 19 dzielnicy ul. Kolejowa,996000.0,"Czyste, Wola, Warszawa, mazowieckie",37.17,1,2/5,do zamieszkania,,garaż/miejsce parkingowe,,https://www.otodom.pl/pl/oferta/apartament-z-loggia-w-19-dzielnicy-ul-kolejowa-ID4nPxJ,Mazowieckie,Warszawa
3-pokojowe mieszkanie 52m2 + taras Bez Pośredników,,"ul. Batalionów Chłopskich, Chrzanów, Bemowo, Warszawa, mazowieckie",52.67,3,5/6,do wykończenia,,garaż/miejsce parkingowe,"taras, balkon",https://www.otodom.pl/pl/oferta/3-pokojowe-mieszkanie-52m2-taras-bez-posrednikow-ID4iruL,Mazowieckie,Warszawa
Przestronne | z balkonem | Gocław,1599000.0,"ul. gen. Romana Abrahama, Gocław, Praga-Południe, Warszawa, mazowieckie",125.0,5,3/6,do zamieszkania,,garaż/miejsce parkingowe,balkon,https://www.otodom.pl/pl/oferta/przestronne-z-balkonem-goclaw-ID4nUW7,Mazowieckie,Warszawa
Wysoka Stopa Zwrotu - Świetne Miejsce Stara Praga,765000.0,"Stara Praga, Praga-Północ, Warszawa, mazowieckie",27.56,1,3/5,,miejskie,,balkon,https://www.otodom.pl/pl/oferta/wysoka-stopa-zwrotu-swietne-miejsce-stara-praga-ID4nUW5,Mazowieckie,Warszawa
Okazja 3 Pokoje w apartamentowcu przy Ch Arkadia,1300000.0,"al. Aleja Jana Pawła II, Muranów, Śródmieście, Warszawa, mazowieckie",74.6,3,9/9,do wykończenia,miejskie,garaż/miejsce parkingowe,,https://www.otodom.pl/pl/oferta/okazja-3-pokoje-w-apartamentowcu-przy-ch-arkadia-ID4nUW3,Mazowieckie,Warszawa
Przestronne 3-pokojowe mieszkanie do wprowadzenia!,950000.0,"ul. Palmowa, Wawer, Wawer, Warszawa, mazowieckie",90.7,3,1/3,do zamieszkania,kotłownia,garaż/miejsce parkingowe,balkon,https://www.otodom.pl/pl/oferta/przestronne-3-pokojowe-mieszkanie-do-wprowadzenia-ID4njkY,Mazowieckie,Warszawa
Luksusowy apartament na Bliskiej Woli,2000000.0,"Juliana Konstantego Ordona, Odolany, Wola, Warszawa, mazowieckie",73.76,3,parter/8,do zamieszkania,miejskie,garaż/miejsce parkingowe,"ogródek, taras",https://www.otodom.pl/pl/oferta/luksusowy-apartament-na-bliskiej-woli-ID4nMut,Mazowieckie,Warszawa
Atrakcyjne słoneczne mieszkanie 2 pok. 51m2 + 6m2,669000.0,"ul. Igańska, Grochów, Praga-Południe, Warszawa, mazowieckie",51.0,2,4/13,do zamieszkania,miejskie,garaż/miejsce parkingowe,,https://www.otodom.pl/pl/oferta/atrakcyjne-sloneczne-mieszkanie-2-pok-51m2-6m2-ID4nJXZ,Mazowieckie,Warszawa
Nowe | Wola | 2 Pokoje | Apartament 2020r | Kw,718500.0,"ul. Stańczyka, Odolany, Wola, Warszawa, mazowieckie",38.0,2,6/8,do zamieszkania,miejskie,,balkon,https://www.otodom.pl/pl/oferta/nowe-wola-2-pokoje-apartament-2020r-kw-ID4nxMe,Mazowieckie,Warszawa
Luksusowy apartament w sercu prestiżowej dzielnice,1180000.0,"al. Aleja Rzeczypospolitej 33, Błonia Wilanowskie, Wilanów, Warszawa, mazowieckie",52.3,3,parter/4,do zamieszkania,miejskie,garaż/miejsce parkingowe,"ogródek, taras",https://www.otodom.pl/pl/oferta/luksusowy-apartament-w-sercu-prestizowej-dzielnice-ID4myU1,Mazowieckie,Warszawa
Komfortowy apartament na Ursynowie z ogródkiem,1751900.0,"ul. Wilczy Dół, Kabaty, Ursynów, Warszawa, mazowieckie",89.62,4,parter/4,do wykończenia,miejskie,garaż/miejsce parkingowe,ogródek,https://www.otodom.pl/pl/oferta/komfortowy-apartament-na-ursynowie-z-ogrodkiem-ID4nUUh,Mazowieckie,Warszawa
Komfortowy apartament na Mokotowię,3547119.0,"ul. Władysława Orkana, Ksawerów, Mokotów, Warszawa, mazowieckie",130.89,4,parter/3,do wykończenia,inne,garaż/miejsce parkingowe,"ogródek, taras",https://www.otodom.pl/pl/oferta/komfortowy-apartament-na-mokotowie-ID4nUUg,Mazowieckie,Warszawa
"Komfortowe, trzypokojowe mieszkanie na Tarchominie",782000.0,"ul. Myśliborska, Tarchomin, Białołęka, Warszawa, mazowieckie",62.07,3,1/4,do wykończenia,miejskie,garaż/miejsce parkingowe,balkon,https://www.otodom.pl/pl/oferta/komfortowe-trzypokojowe-mieszkanie-na-tarchominie-ID4nrzz,Mazowieckie,Warszawa
Unikatowy Apartament w prestiżowej części Mokotowa,3939810.0,"Białej Koniczyny, Stegny, Mokotów, Warszawa, mazowieckie",187.61,4,1/2,,miejskie,garaż/miejsce parkingowe,taras,https://www.otodom.pl/pl/oferta/unikatowy-apartament-w-prestizowej-czesci-mokotowa-ID4nUU9,Mazowieckie,Warszawa
Komfortowe mieszkanie na Bielanach,1684500.0,"al. Aleja Władysława Reymonta, Stare Bielany, Bielany, Warszawa, mazowieckie",80.21,4,1/4,do wykończenia,miejskie,garaż/miejsce parkingowe,,https://www.otodom.pl/pl/oferta/komfortowe-mieszkanie-na-bielanach-ID4nRAa,Mazowieckie,Warszawa
Komfortowy apartament na Bemowie,1990000.0,"ul. Strońska, Górce, Bemowo, Warszawa, mazowieckie",107.4,4,6/6,do wykończenia,miejskie,garaż/miejsce parkingowe,taras,https://www.otodom.pl/pl/oferta/komfortowy-apartament-na-bemowie-ID4ek2C,Mazowieckie,Warszawa
"Komfortowy apartament , Centrum Wola",2777500.0,"ul. Kolejowa, Czyste, Wola, Warszawa, mazowieckie",113.16,5,6/8,do wykończenia,miejskie,garaż/miejsce parkingowe,taras,https://www.otodom.pl/pl/oferta/komfortowy-apartament-centrum-wola-ID4nrHM,Mazowieckie,Warszawa
Penthouse otoczony tarasem o pow. 166m2 z widokiem,1990000.0,"Górce, Bemowo, Warszawa, mazowieckie",107.4,5,6/6,do wykończenia,miejskie,garaż/miejsce parkingowe,"ogródek, taras",https://www.otodom.pl/pl/oferta/penthouse-otoczony-tarasem-o-pow-166m2-z-widokiem-ID4nLIf,Mazowieckie,Warszawa
"Bardzo ładny 3 pokojowy apartament ""Hubertus """,1490000.0,"ul. Obrzeżna, Służew, Mokotów, Warszawa, mazowieckie",88.0,3,3/6,do zamieszkania,miejskie,garaż/miejsce parkingowe,balkon,https://www.otodom.pl/pl/oferta/bardzo-ladny-3-pokojowy-apartament-hubertus-ID4nGbQ,Mazowieckie,Warszawa
"2 pokoje, balkon, miejsce parkingowe w cenie",657000.0,"Gocławek, Praga-Południe, Warszawa, mazowieckie",40.05,2,,,,,,https://www.otodom.pl/pl/oferta/2-pokoje-balkon-miejsce-parkingowe-w-cenie-ID4nUT7,Mazowieckie,Warszawa
